{
  "schema_version": "smpcc-r8-liquid-target-u3-stdio-apparmor-transport-probe-policy-v2",
  "document_type": "SMPCC_R8_LIQUID_TARGET_U3_STDIO_APPARMOR_TRANSPORT_PROBE_POLICY",
  "policy_id": "LIQUID_ZRJ_MSI_U2404_U3_STDIO_APPARMOR_TRANSPORT_PROBE_V2",
  "host_id": "LIQUID_ZRJ_MSI_U2404",
  "development_only": true,
  "formal": false,
  "physical_primary_eligible": false,
  "static_review_authorized": true,
  "profile_parse_load_select_authorized": false,
  "harmless_probe_execution_authorized": false,
  "production_runtime_authorized": false,
  "allowed_gate_commands": ["self-check"],
  "frozen_identity": {
    "probe_id": "u3_stdio_apparmor_transport_probe_v2_20260807T141934Z",
    "attempt_root": "/home/zrj/scout_liquid_lab/build/u3_stdio_apparmor_transport_probe_v2_20260807T141934Z.partial",
    "execution_receipt": "/home/zrj/scout_liquid_lab/audits/u3_stdio_apparmor_transport_probe_v2_20260807T141934Z.execution.json",
    "lifecycle_receipt": "/home/zrj/scout_liquid_lab/audits/u3_stdio_apparmor_transport_probe_v2_20260807T141934Z.lifecycle.json",
    "lifecycle_failure_receipt": "/home/zrj/scout_liquid_lab/audits/u3_stdio_apparmor_transport_probe_v2_20260807T141934Z.lifecycle_incomplete.json",
    "snapshot_root": "/run/r8-liquid-u3_stdio_apparmor_transport_probe_v2_20260807T141934Z.snapshot",
    "bootstrap_profile": "r8-liquid-u3-stdio-transport-bootstrap-v2-20260807t141934z",
    "runtime_profile": "r8-liquid-u3-stdio-transport-runtime-v2-20260807t141934z"
  },
  "security_decision": {
    "transport": "VERSIONED_STDIN_FRAME_AND_SINGLE_SUCCESS_ONLY_STDOUT_FRAME",
    "removed_designs": [
      "bwrap_file_fd_input",
      "bwrap_bind_fd_output",
      "host_writable_output_mount"
    ],
    "production_design_dependency": "none_until_a_fresh_probe_success_and_fresh_runtime_review",
    "workspace_binary_execution": "forbidden",
    "gencase_or_solver_execution": "forbidden"
  },
  "reviewed_bytes": {
    "loader": {
      "delivery": "exact_python_-c_argument",
      "encoding": "ascii",
      "sha256": "541d9bd1e9bcb50f278c7ecedd351620582d5f89b71969538f76564e54e7d194",
      "size_bytes": 560,
      "maximum_size_bytes": 2048
    },
    "helper": {
      "delivery": "stdin_after_versioned_header_then_hash_before_compile_exec",
      "encoding": "utf-8",
      "sha256": "ecd8cac26d8e988ecf818181fbd856299a3b05e34e999ef16c094f5c48fbfd06",
      "size_bytes": 9626,
      "maximum_size_bytes": 16384
    },
    "inputs": [
      {
        "name": "probe_alpha.bin",
        "size_bytes": 264,
        "sha256": "5cefd89d7437670de4daa12d70d7bffd00c4d527297907baa87ec668f3ab3557",
        "guest_path": "/work/input/probe_alpha.bin",
        "guest_mode": "0400",
        "classification": "FIXED_SYNTHETIC_HARMLESS_PROBE_BYTES"
      },
      {
        "name": "probe_beta.bin",
        "size_bytes": 519,
        "sha256": "19a64358adb59e1d78ee82a6cf1bf37990c9eb1297b93eb047dfd41657c7fa0d",
        "guest_path": "/work/input/probe_beta.bin",
        "guest_mode": "0400",
        "classification": "FIXED_SYNTHETIC_HARMLESS_PROBE_BYTES"
      },
      {
        "name": "probe_gamma.bin",
        "size_bytes": 993,
        "sha256": "f7a3e62ee3472c01a7dd435ab94ac63fe187140400874032b6c1c5c171fcdcbe",
        "guest_path": "/work/input/probe_gamma.bin",
        "guest_mode": "0400",
        "classification": "FIXED_SYNTHETIC_HARMLESS_PROBE_BYTES"
      }
    ]
  },
  "trusted_system_tools": {
    "aa_exec": {
      "path": "/usr/bin/aa-exec",
      "sha256": "f28cbce3c8664cab5154492fdbc55ecb937a3e7ce1a9478c881a5f5965d7ce3e"
    },
    "aa_status": {
      "path": "/usr/sbin/aa-status",
      "sha256": "af9f579ad039f0e669bfb15735c55efd17896f838d684e7f9be15b09fa1e2dd4"
    },
    "apparmor_parser": {
      "path": "/usr/sbin/apparmor_parser",
      "sha256": "6bc852b37807961c14976be9a227ae96bd817f73b5189cb0e0ff5eca4448c01c"
    },
    "bwrap": {
      "path": "/usr/bin/bwrap",
      "sha256": "52231e1caf55bcbc667b269f49c63599a6f7db4767ae6a039580d0ff853db712"
    },
    "python": {
      "path": "/usr/bin/python3.12",
      "sha256": "1643dacd9feaedc58f3cc581e4d22577dfe25c09b10282936186ccf0f2e61118"
    },
    "setpriv": {
      "path": "/usr/bin/setpriv",
      "sha256": "96b083b79c32fd2f0c29657e88e20c7495839349fc64ad5d0503f32d26bf8733"
    },
    "sleep": {
      "path": "/usr/bin/sleep",
      "sha256": "a65efec857cfac0d4f43fc53affa73794ff1d1fdcb547931d4b92a98bda8e646"
    },
    "timeout": {
      "path": "/usr/bin/timeout",
      "sha256": "4fccd5b0192653a2446b745d5385ea547b78e466150e07ade9e2caff2b7f4e08"
    }
  },
  "stdio_transport": {
    "stdin_magic_hex": "52384c51535444494f50524f42453200",
    "stdin_layout": [
      "magic_16",
      "helper_size_u32_be",
      "helper_sha256_raw_32",
      "helper_exact_bytes",
      "three_repetitions_of_size_u64_be_sha256_raw_32_exact_bytes",
      "strict_eof"
    ],
    "input_count": 3,
    "loader_verifies_helper_before_compile_exec": true,
    "helper_verifies_each_announced_and_observed_size_hash": true,
    "host_stdin_consumed_to_strict_eof": true,
    "original_fd0_closed": true,
    "fd0_replaced_by_guest_internal_eof_pipe": true,
    "runtime_inherits_only_eof_pipe_on_fd0": true,
    "no_pass_fds": true,
    "stdout_magic_hex": "52384c51535444494f50415353563200",
    "stdout_layout": [
      "success_magic_16",
      "json_size_u32_be",
      "canonical_ascii_json",
      "json_sha256_raw_32"
    ],
    "stdout_success_only": true,
    "stdout_maximum_frame_bytes": 16384,
    "stderr_failure_marker_maximum_bytes": 64
  },
  "identity_contract": {
    "outer_setpriv_uid_gid": [1000, 1000],
    "supplementary_groups": [],
    "host_child_capability_sets_all_zero": true,
    "host_child_no_new_privs": 1,
    "guest_uid_fields": [0, 0, 0, 0],
    "guest_gid_fields": [0, 0, 0, 0],
    "guest_groups": [],
    "guest_capability_sets_all_zero": true,
    "guest_no_new_privs": 1,
    "bwrap_cap_drop": "ALL"
  },
  "isolation": {
    "network_namespace": "unshared_no_host_network",
    "pid_namespace": "unshared",
    "ipc_namespace": "unshared",
    "uts_namespace": "unshared",
    "nested_userns_disabled": true,
    "host_read_only_mounts": ["/usr"],
    "host_writable_mounts": [],
    "guest_dev": "absent",
    "guest_proc": "/proc_for_identity_label_and_fd_checks",
    "guest_work_tmpfs_bytes": 67108864,
    "guest_work_tmpfs_verification": "mountinfo_exact_tmpfs_and_statvfs_total_bytes_exact",
    "guest_work_tmpfs_inode_ceiling": "UNCLAIMED_BWRAP_0_9_HAS_NO_NR_INODES_OPTION",
    "guest_created_regular_files_exactly": [
      "/work/input/probe_alpha.bin",
      "/work/input/probe_beta.bin",
      "/work/input/probe_gamma.bin"
    ],
    "bwrap_argv_template": [
      "/usr/bin/bwrap",
      "--die-with-parent",
      "--new-session",
      "--unshare-user",
      "--unshare-pid",
      "--unshare-net",
      "--unshare-ipc",
      "--unshare-uts",
      "--disable-userns",
      "--assert-userns-disabled",
      "--uid",
      "0",
      "--gid",
      "0",
      "--cap-drop",
      "ALL",
      "--hostname",
      "r8-liquid-stdio-probe-v2",
      "--clearenv",
      "--setenv",
      "HOME",
      "/nonexistent",
      "--setenv",
      "PATH",
      "/usr/bin",
      "--setenv",
      "LC_ALL",
      "C.UTF-8",
      "--setenv",
      "LANG",
      "C.UTF-8",
      "--setenv",
      "TZ",
      "UTC",
      "--ro-bind",
      "/usr",
      "/usr",
      "--symlink",
      "usr/lib",
      "/lib",
      "--symlink",
      "usr/lib64",
      "/lib64",
      "--size",
      "67108864",
      "--tmpfs",
      "/work",
      "--proc",
      "/proc",
      "--chdir",
      "/work",
      "--",
      "/usr/bin/python3.12",
      "-I",
      "-B",
      "-c",
      "<PINNED_LOADER_SOURCE>"
    ]
  },
  "fixed_command": {
    "outer_argv_template": [
      "/usr/bin/timeout",
      "--foreground",
      "--signal=TERM",
      "--kill-after=2s",
      "15s",
      "/usr/bin/setpriv",
      "--reuid=1000",
      "--regid=1000",
      "--clear-groups",
      "--no-new-privs",
      "--bounding-set=-all",
      "--inh-caps=-all",
      "--ambient-caps=-all",
      "--",
      "/usr/bin/aa-exec",
      "-p",
      "r8-liquid-u3-stdio-transport-bootstrap-v2-20260807t141934z",
      "--",
      "/usr/bin/bwrap",
      "--die-with-parent",
      "--new-session",
      "--unshare-user",
      "--unshare-pid",
      "--unshare-net",
      "--unshare-ipc",
      "--unshare-uts",
      "--disable-userns",
      "--assert-userns-disabled",
      "--uid",
      "0",
      "--gid",
      "0",
      "--cap-drop",
      "ALL",
      "--hostname",
      "r8-liquid-stdio-probe-v2",
      "--clearenv",
      "--setenv",
      "HOME",
      "/nonexistent",
      "--setenv",
      "PATH",
      "/usr/bin",
      "--setenv",
      "LC_ALL",
      "C.UTF-8",
      "--setenv",
      "LANG",
      "C.UTF-8",
      "--setenv",
      "TZ",
      "UTC",
      "--ro-bind",
      "/usr",
      "/usr",
      "--symlink",
      "usr/lib",
      "/lib",
      "--symlink",
      "usr/lib64",
      "/lib64",
      "--size",
      "67108864",
      "--tmpfs",
      "/work",
      "--proc",
      "/proc",
      "--chdir",
      "/work",
      "--",
      "/usr/bin/python3.12",
      "-I",
      "-B",
      "-c",
      "<PINNED_LOADER_SOURCE>"
    ],
    "loader_placeholder_occurrences": 1,
    "loader_placeholder_replacement": "exact_LOADER_SOURCE_ascii_text",
    "environment": {
      "HOME": "/nonexistent",
      "PATH": "/usr/bin",
      "LC_ALL": "C.UTF-8",
      "LANG": "C.UTF-8",
      "TZ": "UTC"
    },
    "shell": false,
    "close_fds": true,
    "pass_fds": []
  },
  "runtime_transition": {
    "argv": ["/usr/bin/sleep", "30"],
    "forced_rule": "/usr/bin/sleep rpx -> r8-liquid-u3-stdio-transport-runtime-v2-20260807t141934z,",
    "expected_attr_current": "r8-liquid-u3-stdio-transport-runtime-v2-20260807t141934z (enforce)",